{
  "schema_version": "1.0",
  "approved_understanding_sha256": "ff224a6a4a36a6b67d77be24602b5d0489d482a3cec2128ad2e3f8f5323d0ced",
  "mode": "substantial",
  "direction_strategy": "single-foundation-adaptations",
  "directions": [
    {
      "id": "guided-fieldbook",
      "title": "Guided Fieldbook",
      "thesis": "Lead with a clear case story, then reveal the evidence and downloads needed to adapt it responsibly.",
      "adaptation_axis": "reader-led case understanding",
      "primary_reference": {
        "slug": "ibm-carbon",
        "responsibility": "dominant visual foundation"
      },
      "preserved_primary_traits": [
        "Productive utility type paired with selective expressive hierarchy",
        "A visible alignment grid across narrative, evidence, and actions",
        "Role-based color and contextual surface layers",
        "Compact scanning regions separated from calmer reading regions"
      ],
      "secondary_references": [
        {
          "slug": "guardian-source",
          "role": "content hierarchy",
          "scope": "Long-form case order and distinct narrative, reading, and utility roles only."
        },
        {
          "slug": "github-primer",
          "role": "mobile behavior",
          "scope": "Reflow named content regions without removing evidence, comparison, or download actions."
        }
      ],
      "dimension_signatures": {
        "composition": "A narrative lead occupies the opening grid, followed by aligned context, evidence, limitations, and download regions.",
        "typography": "Expressive case thesis and section heads contrast with productive metadata, evidence labels, and controls.",
        "color": "Neutral layers carry structure while one original accent marks actions and restrained lane color marks classification.",
        "density": "Open reading passages alternate with compact evidence, metadata, and related-case strips.",
        "imagery": "Original abstract previews and data diagrams act as evidence when useful; the reading sequence remains complete without them.",
        "motion": "Small state transitions disclose evidence and preserve reading position; reduced motion removes nonessential movement.",
        "interaction": "Readers move from thesis to evidence to download, with filters and comparison available as supporting paths.",
        "hierarchy": "Context, intent, value, quality, and limitations precede file choices and machine-readable detail.",
        "surfaces": "Rules, spacing, and a small number of contextual layers separate narrative, proof, and actions without card repetition."
      },
      "role_invariants": [
        {
          "domain": "color",
          "source_role": "Carbon uses neutral layers for structure and reserves semantic color for action and state.",
          "target_role": "Original neutrals organize the reading path; one action accent and bounded lane colors keep stable meanings.",
          "action": "adapt",
          "reason": "Semantic restraint transfers without copying IBM blue or Guardian section colors."
        },
        {
          "domain": "media",
          "source_role": "The selected Carbon evidence does not establish a transferable image identity.",
          "target_role": "Only original case previews and evidence diagrams may support the narrative, and core meaning remains textual.",
          "action": "reject",
          "reason": "This prevents borrowed source identity and keeps unsupported imagery out of the design logic."
        },
        {
          "domain": "density",
          "source_role": "Productive work stays compact while expressive explanation receives more scale and space.",
          "target_role": "Case reading is calm, while provenance, evidence, related cases, and downloads remain compact and scannable.",
          "action": "preserve",
          "reason": "The productive and expressive contrast is the primary Carbon relationship for this direction."
        },
        {
          "domain": "typography",
          "source_role": "Carbon separates productive and expressive type by task.",
          "target_role": "Original fonts distinguish case thesis, sustained reading, metadata, evidence labels, and controls.",
          "action": "adapt",
          "reason": "The task-based hierarchy transfers while IBM Plex and Guardian font families remain excluded."
        }
      ],
      "signature_traits": [
        "A case thesis that orients the reader before controls",
        "Visible transitions from explanation to evidence to download",
        "Productive and expressive density used on the same page",
        "Editorial hierarchy without newspaper styling"
      ],
      "forbidden_drift": [
        "Do not turn every section into a rounded card.",
        "Do not copy IBM Plex, IBM blue, Guardian fonts, or newspaper identity.",
        "Do not bury limitations or provenance below download controls.",
        "Do not make the human-readable path depend on imagery or animation."
      ],
      "risks": [
        "The narrative opening can delay a repeat visitor who wants a file immediately.",
        "Long case pages can become heavy if evidence is not disclosed progressively."
      ],
      "rejected_alternatives": [
        {
          "alternative": "Magazine-style gallery",
          "reason": "Large imagery would outrun the available evidence and weaken the download-first job."
        },
        {
          "alternative": "Pure documentation portal",
          "reason": "It would flatten the expressive case thesis that makes the reference useful to a human reader."
        }
      ],
      "evidence_refs": [
        {"slug": "ibm-carbon", "evidence_id": "CARBON-E01"},
        {"slug": "ibm-carbon", "evidence_id": "CARBON-E02"},
        {"slug": "ibm-carbon", "evidence_id": "CARBON-E03"},
        {"slug": "ibm-carbon", "evidence_id": "CARBON-E06"},
        {"slug": "guardian-source", "evidence_id": "GUARDIAN-E04"},
        {"slug": "guardian-source", "evidence_id": "GUARDIAN-E05"},
        {"slug": "github-primer", "evidence_id": "PRIMER-E02"},
        {"slug": "github-primer", "evidence_id": "PRIMER-E05"}
      ],
      "feasibility": "Fits the existing dependency-free static Site. It requires new content hierarchy and download views but no backend or new software.",
      "presentation": {
        "summary": "A human-first field guide that turns each case into an understandable path from design problem to evidence to download.",
        "fit": "Best when understanding and responsible adaptation should feel as important as finding and downloading a file.",
        "risk": "Repeat users may find the narrative layer slower than a dense work surface.",
        "expert_detail": "Carbon owns the grid, semantic layers, and productive versus expressive relationship. Guardian informs long-form hierarchy, and Primer supplies mobile reflow only."
      }
    },
    {
      "id": "analyst-workbench",
      "title": "Analyst Workbench",
      "thesis": "Make search, comparison, evidence inspection, and download one compact working environment for repeated use.",
      "adaptation_axis": "operator-led comparison and retrieval",
      "primary_reference": {
        "slug": "ibm-carbon",
        "responsibility": "dominant visual foundation"
      },
      "preserved_primary_traits": [
        "A visible grid for dense controls, results, and evidence",
        "Productive typography as the dominant working register",
        "Role-based action, state, border, and layer colors",
        "Component choice based on whether information is grouped, switched, or compared"
      ],
      "secondary_references": [
        {
          "slug": "elastic-eui",
          "role": "density treatment",
          "scope": "Complete behavior for compact filters, result rows, selection, sorting, pagination, and row actions."
        },
        {
          "slug": "github-primer",
          "role": "mobile behavior",
          "scope": "Recombine filter, result, comparison, metadata, and action regions without losing function."
        }
      ],
      "dimension_signatures": {
        "composition": "A persistent control rail, dense result region, and visible comparison or detail region share one aligned workspace.",
        "typography": "Compact productive type dominates controls, rows, counts, provenance, and values; expressive type is limited to route titles.",
        "color": "Neutral working layers dominate; action, focus, selection, warning, and error roles use explicit original semantic colors.",
        "density": "High information density supports scanning and repeated operations, with touch-safe spacing and a less dense mobile sequence.",
        "imagery": "Small original abstract previews act as recognition cues, never as the primary catalog structure.",
        "motion": "Productive microinteractions explain selection, filtering, sorting, panel changes, and download status without page choreography.",
        "interaction": "Keyboard-ready filters, sort, multi-select comparison, evidence inspection, and downloads stay close to the records they affect.",
        "hierarchy": "Current query, result count, selected cases, evidence state, and available actions lead the workspace; case details and downloads still retain context, intent, value, evidence quality, and limitations.",
        "surfaces": "Contextual layers and borders define control, result, comparison, and status regions with little decorative elevation."
      },
      "role_invariants": [
        {
          "domain": "color",
          "source_role": "Carbon assigns stable semantic roles to action, focus, status, border, and layer tokens.",
          "target_role": "Original tokens distinguish actions, selection, focus, data quality, download state, and workspace layers.",
          "action": "preserve",